id,Pregunta,Categoria,Respuestas 1,Respuesta 2,Respuesta 3,Respuesta 4,Correcta,MasInfo
32,"En Argentina, ¿qué ley contena los actos discriminatorios?",Derecho,Ley 25.808,Ley 25.273,Ley 23.592,Ley 26.150,Ley 23.592,"La ley 23.592, declara en su “ARTICULO 1°.- Quien arbitrariamente impida, obstruya, restrinja o de algún modo menoscabe el pleno ejercicio sobre bases igualitarias de los derechos y garantías fundamentales reconocidos en la Constitución Nacional, será obligado, a pedido del damnificado, a dejar sin efecto el acto discriminatorio o cesar en su realización y a reparar el daño moral y material ocasionados. A los efectos del presente artículo se considerarán particularmente los actos u omisiones discriminatorios determinados por motivos tales como raza, religión, nacionalidad, ideología, opinión política o gremial, sexo, posición económica, condición social o caracteres físicos."
33,"En Argentina, un menor de edad ¿puede ser detenido por averiguación de antecedente? ",Derecho,"Si, más cuando esté solo. ","Si, más si son pasadas de las 22hs. ","Si, más si no se tiene D.N.I.","No, no puede ser detenido por averiguación de antecedentes. ","No, no puede ser detenido por averiguación de antecedentes. ","Los menores de 18 años pueden ser detenidos si están cometiendo un delito o por orden judicial, pero no deberían serlo “en averiguación de identidad” o “para identificar” o ""por averiguación de antecedentes"". Pero en el caso en que ocurra, recordá que no te pueden esposar, ni llevar en un auto que no se identifique como policial. Tampoco te pueden encerrar en un calabozo, ni tenerte junto a mayores de edad, ni quitarte los cordones y/o cinturón, ni hacerte ""tocar el pianito"", ni incomunicarte. Lo primero que tiene que hacer el Policía que te detuvo al entrar a la Comisaría es avisar al Juez de Menores de turno. Es importante que vos o alguien de tu confianza que sepa de tu detención pregunte qué juez está de turno, y si le dieron intervención. Tenés derecho a llamar de inmediato a tu familia, a tu abogado o a una persona de confianza."
34,"En Argentina, ¿Cuántas horas puede estar demorada una persona por averiguación de indentidad?",Derecho,Todas las que hagan falta.,Hasta 24hs. ,No pueden demorarte.,Hasta 10 horas. ,Hasta 10 horas. ,
35,"En Argentina, ¿cuál es la ley de protección integral de las mujeres?",Derecho,Ley 25.808,Ley 25.273,Ley 23.592,Ley 26.485,Ley 26.485,"La ley na­cio­nal Nº 26.485 bus­ca la “pro­tec­ción in­te­gral pa­ra pre­ve­nir, san­cio­nar y erra­di­car la vio­len­cia con­tra las mu­je­res en los ám­bi­tos en que de­sa­rro­llen sus re­la­cio­nes in­ter­per­so­na­les”, se­gún des­ta­ca el tex­to de la le­gis­la­ción.En­tre sus ob­je­ti­vos, la ley que guía el ac­cio­nar del Con­se­jo Pro­vin­cial es­ta­ble­ce que pre­ten­de eli­mi­nar la dis­cri­mi­na­ción en­tre mu­je­res y va­ro­nes en to­dos los ór­de­nes de la vi­da. Sos­tie­ne, ade­más, que se de­be tra­ba­jar por “el de­re­cho de las mu­je­res a vi­vir una vi­da sin vio­len­cia”; “las con­di­cio­nes ap­tas pa­ra sen­si­bi­li­zar y pre­ve­nir, san­cio­nar y erra­di­car la dis­cri­mi­na­ción y la vio­len­cia con­tra las mu­je­res en cual­quie­ra de sus ma­ni­fes­ta­cio­nes y ám­bi­tos”; “el de­sa­rro­llo de po­lí­ti­cas pú­bli­cas de ca­rác­ter in­te­rins­ti­tu­cio­nal so­bre vio­len­cia con­tra las mu­je­res”; “la re­mo­ción de pa­tro­nes so­cio­cul­tu­ra­les que pro­mue­ven y sos­tie­nen la de­si­gual­dad de gé­ne­ro y las re­la­cio­nes de po­der so­bre las mu­je­res”, en­tre otros pun­tos."
36,¿Qué es la línea telefónica 144?,Derecho,Una línea telefónica para situaciones de catástrofes naturales.,Una línea telefónica para consultas sobre sexualidad.,Una línea telefónica para consultas sobre adicciones.,Una línea telefónica para denuncias sobre violencia de género.,Una línea telefónica para denuncias sobre violencia de género.,"La Línea telefónica Nacional 144 está destinada a brindar información, orientación, asesoramiento y contención para las mujeres en situación de violencia de todo el país, los 365 días del año, las 24 horas, de manera gratuita. Esta línea responde a la obligación de garantizar, como Estado Nacional, una respuesta integral y articulada sobre la violencia de género. El equipo de atención de la línea telefónica 144, en su mayoría integrado por profesionales psicólogos y trabajadores sociales, está conformado por operadores y coordinadoras con capacitación en perspectiva de género y violencia contra las mujeres. Al 144 pueden llamar la mujer que es víctima de la violencia o sus familiares, conocidos o amigos para recibir asesoramiento y contención. Es necesario tener en cuenta que la violencia contra las mujeres muchas veces se desarrolla dentro de un ciclo que construye en agresor en el cual se daña la autoestima de la víctima y se la somete a continuas amenazas para convencerla de que no podrá salir de esa situación. Cuando la víctima está mínimamente fortalecida, informada y contenida podrá ser capaz de dar el primer paso y recorrer el camino para salir de la violencia."
37,¿Qué es el acoso sexual?,Derecho,Una método anticonceptivo.,Una infección de transmisión sexual.,Es una forma de demostrar amor.,Es una intimidación sexual. ,Es una intimidación sexual. ,"El acoso sexual incluye aquellas conductas consistentes en la solicitud de favores de naturaleza sexual, para sí o para una tercera persona, en las que el sujeto activo se vale de una situación de superioridad laboral, docente o análoga, con el anuncio expreso o tácito a una persona de causarle un mal relacionado con las expectativas que la víctima tenga en el ámbito de la dicha relación, o bajo la promesa de una recompensa o de un premio en el ámbito de esta. "
38,¿Qué es la línea telefónica 141?,Derecho,Una línea telefónica para situaciones de catástrofes naturales.,Una línea telefónica para consultas sobre sexualidad.,Una línea telefónica para la prevención de adicciones.,Una línea telefónica para denuncias sobre violencia de género.,Una línea telefónica para la prevención de adicciones.,"La línea 141 es el servicio gratuito de SEDRONAR, que brinda atención las 24 horas, en todo el país, con un equipo de profesionales especializados. Permite el contacto inmediato y anónimo para cualquier persona (consumidor, familiar, amigo, profesional de la salud) que necesite ayuda por problemas relacionados con el consumo de alcohol y drogas. Tiene como objetivos ofrecer un espacio de escucha, contención, reflexión y orientación, con conocimiento de la problemática y sus características. La meta es acortar la distancia entre el pedido de ayuda y la posibilidad de concurrir a servicios de admisión y tratamiento cercanos al lugar de residencia de quien consulta. Para lograr estos objetivos, la línea 141 cuenta con un mapa de derivación, cuya base de datos nacional es actualizada permanentemente para contar con la mayor capacidad de respuesta posible. Además, este organismo elabora estadísticas para conocer la demanda específica y los perfiles de consumo. De este modo posibilita un sistema de atención y escucha adecuado al tipo de consultas que se reciben."
38,¿Qué es la línea telefónica 135?,Derecho,Una línea telefónica de asistencia al suicida.,Una línea telefónica para consultas sobre sexualidad.,Una línea telefónica para la prevención de adicciones.,Una línea telefónica para denuncias sobre violencia de género.,Una línea telefónica para la prevención de adicciones.,"La línea 141 es el servicio gratuito de SEDRONAR, que brinda atención las 24 horas, en todo el país, con un equipo de profesionales especializados. Permite el contacto inmediato y anónimo para cualquier persona (consumidor, familiar, amigo, profesional de la salud) que necesite ayuda por problemas relacionados con el consumo de alcohol y drogas. Tiene como objetivos ofrecer un espacio de escucha, contención, reflexión y orientación, con conocimiento de la problemática y sus características. La meta es acortar la distancia entre el pedido de ayuda y la posibilidad de concurrir a servicios de admisión y tratamiento cercanos al lugar de residencia de quien consulta. Para lograr estos objetivos, la línea 141 cuenta con un mapa de derivación, cuya base de datos nacional es actualizada permanentemente para contar con la mayor capacidad de respuesta posible. Además, este organismo elabora estadísticas para conocer la demanda específica y los perfiles de consumo. De este modo posibilita un sistema de atención y escucha adecuado al tipo de consultas que se reciben."
id ,Pregunta,Categoria,Respuestas 1,Respuesta 2,Respuesta 3,Respuesta 4,Correcta,MasInfo
1,¿Qué ley otorga la responsabilidad de educar en la sexualidad a las escuelas y docentes?,Derecho,26150,25500,15200,25150,26150,"En octubre de 2006, el Congreso sancionó la Ley Nacional que crea el Programa Nacional de Educación Sexual Integral (Ley 26.150). Esta ley establece: “Todos los educandos tienen derecho a recibir educación sexual integral en los establecimientos educativos públicos, de gestión estatal y privada de las jurisdicciones nacional, provincial, de la Ciudad Autónoma de Buenos Aires y municipal”. "
2,"¿A partir de que edad, por ley, podes ir solo a informarte a un centro médico?",Derecho,16,15,14,18,14,"Con la reforma del Código Civil, en su artículo 26, se reconoce el derecho de los adolescentes a decidir en aquellos tratamientos no invasivos o que no representen riesgo de vida. Y sólo requiere la asistencia de sus padres para los tratamientos que no encuadran con esa condición"
3,"¿A qué se llama ""Trata de persona""?",Derecho,"""Exclavitud del sigo XXI""",Un delito que atenta contra los derechos humanos,Alquiler o compra y venta de personas,Todas las anteriores,Todas las anteriores,"La trata de personas, conocida hoy en día como la“esclavitud del siglo XXI”, es un delito que atenta contra los derechos humanos pues vulnera la esencia misma de la persona: vida, libertad, integridad y dignidad. La trata de personas es el alquiler o la compra y venta de seres humanos. Es un crimen que anualmente afecta a millones de personas en el mundo y es visto como un proceso que comienza con el reclutamiento de la persona y termina con la explotación de la misma por bandas de crimen organizado."
4,¿Qué puedo hacer si alguien quiere tocar mi cuerpo y yo no quiero?,Derecho,Denunciarlo,Avisarle a tus padres,Hablar con un adulto,Todas las anteriores,Todas las anteriores,"Es muy importante, para su propio cuidado, que se le enseñe a los niños y jóvenes: “Si te sentís mal porque alguien quiere ver o tocar tus partes íntimas, tenés que decir ‘no’, estás en todo tu derecho y se lo tenés que contar rápido a alguien de confianza, como a algún familiar o a tu maestra”."
5,"¿A qué se denomina ""Grooming""?",Derecho,"Engaño de un adulto hacia un niño, via internet, con el fin de abusar sexualmente de el.","Engaño de un niño hacia un adulto, via internet, con el fin de abusar sexualmente de el.","Engaño de un adulto hacia un niño, via internet, con el fin de ganarse su amistad.","Engaño de un niño hacia un adulto, via internet, con el fin de ganarse su amistad.","Engaño de un adulto hacia un niño, via internet, con el fin de abusar sexualmente de el.","Con esa palabra, de origen inglés, se nombra a todas las conductas y acciones inadecuadas que, en general, una persona adulta realiza para ganarse la confianza de un niño o adolescente a través de internet y así obtener concesiones sexuales. En general, estas personas adoptan una identidad falsa en las redes sociales y chats. Así, haciéndose pasar por otras/os, conocen menores de edad. Se hacen amigos y los invitan a intercambiar fotos (a veces de contenido sexual). Cuando ya establecieron una relación on line, concretan un encuentro con sus víctimas e intentan violarlas o abusar sexualmente de ellas."
6,¿A qué se denomina ciberbullying? ,Derecho,Un insulto en inglés,Un método anticonceptivo,Acoso a través de las redes sociales.,Una I.T.S.,Acoso a través de las redes sociales.,"Estamos ante un caso de ciberbullying cuando un o una menor atormenta, amenaza, hostiga, humilla o molesta a otro/a mediante Internet, teléfonos móviles, o redes sociales. El anonimato, la no percepción directa e inmediata del daño causado y la adopción de roles imaginarios en la Red convierten al ciberbullying en un grave problema."
7,¿A qué se denomina bullying?,Derecho,Un pasatiempo,Algo normal entre los adolescentes,Es un abuso y causa dolor,Una broma,Es un abuso y causa dolor,"El acoso escolar (también conocido como hostigamiento escolar, matonaje escolar, matoneo escolar, maltrato escolar o en inglés bullying) es cualquier forma de maltrato psicológico, verbal o físico producido entre escolares de forma reiterada a lo largo de un tiempo determinado en la escuela o fuera de ella. "
8,¿A quién afecta el bullying?,Derecho,A los niños que sufren violencia,A los niños que son testigos de la violencia,A los que atacan y son violentos,A todos,A todos. ,"El bullying nos afecta a todos, porque la violencia genera más violencia. Por eso es una tarea que entre todos debemos tratar de erradicar de las escuelas. Por eso ante un caso de bullying, hay que hablar con alguien, con algún padres, con algún profesor o con alguien de confianza para que intervenga y detenga el bullying. Se debe recordar que pedir ayuda no es delatar a nadie, es ayudar a alguien. "
9,¿Cuáles son algunas de las consecuencias del Bullying?,Derecho,Sentir miedo,Abandonar la escuela,Bajas calificaciones,Todas las anteriores,Todas las anteriores,"Entre las consecuencias del bullying, la más evidente es la disminución del rendimiento escolar, debido a un cambio en el comportamiento habitual de los chicos. Este efecto negativo afecta tanto a la víctima como al acosador, y a veces también a los escolares que favorecen estos actos o a otros que asumen una actitud totalmente pasiva. Otras consecuencias son: Baja autoestima; Trastornos emocionales; Problemas psicosomáticos; Depresión, ansiedad y pensamientos suicidas. "
10,¿Qué puedo hacer para parar el Bullying?,Derecho,No quedarse callado y  no ser indiferente.," Junto a otros compañeros, decirle al agresor que pare.", Decirle al maestro o a algún adulto de la escuela.,Todas las anteriores,Todas las anteriores,"Para detener el bullying lo primero y principal es no quedarnos callados ante el problema. Habla con alguien de confianza: Si por más que intentas detenerlo, no puedes lograrlo, habla con alguien de confianza como tus padres o maestros. Al principio puede parecer difícil hablar de este tema con alguien más, pero recuerda que todo es por tu propio bien."
11,"¿A qué se denomina ""sexting""?",Derecho,"El envío de contenido sexual del remitente, a otras personas, por medio de celulares.","El envío de contenido sexual del receptor, a otras personas, por medio de celulares.","El envío de contenido sexual a una persona, con el fin de extorcionarla","El envío de contenido sexual del remitente, a otras personas, por medio de cartas.","El envío de contenido sexual del remitente, a otras personas, por medio de celulares.","El Sexting es el envío de mensajes, fotos o videos de contenido sexual por medio de teléfonos celulares. Evidentemente, esta práctica tiene muchos riesgos, y por eso también se ha extendido el uso de aplicaciones que prometen destruir el mensaje pasado un tiempo determinado (ej:Snapchat). Cualquier imagen sexual que salga de tu teléfono, de tu webcam o de tu email, puede acabar en un web porno proporcionándoles beneficios económicos a terceros y alimentando las fantasías eróticas de miles de internautas. Recuerda que el contenido que se sube a internet es muy difícil de bajar una vez que si empieza a compartir. "
12,"¿Cuales son los riesgos del ""sexting"" (invío de imagenes y videos sexuales por celulares)?",Derecho,"Ninguno, si se confia en la persona a la cual se le envía las imagenes. ","Ninguno, si se ama a la persona a quién le enviamos la imagen. ",Existen muchas probabilidades que la imagen o video se viralice. ,Existen pocas posibilidades de que una imagen se viralice. ,Existen muchas probabilidades que la imagen o video se viralice. ,"La práctica del sexting implica diversos riesgos de carácter psicológico, legal e incluso de la integridad física de los participantes. Muchos de sus practicantes son menores de edad y no son conscientes de ellos. Una persona cuya imagen o vídeo erótico es distribuido sin control puede verse humillada públicamente y acosada, y sufrir graves trastornos a causa de ello. Se han producido hasta casos de suicidio originado en el sexting y muchos casos de ansiedad, depresión, pérdida de autoestima, trauma, humillación, aislamiento social, etc. Sin importar cuanto se ame a una persona, se debe tener encuenta los riesgos que implicaria que dicha imagen o video sea difundido. En todo caso es importante la orientación de un adulto. "
13,¿Qué se debe tener en cuanta cuando se usa la webcam?,Derecho,"Ninguno, es muy segura. ",Lo que envía la webcam puede ser grabado al otro lado.,La imagen que se está viendo por la webcam puede ser una grabación,Las dos últimas. ,Las dos últimas. ,"Cuando se transmite por webcam se debe tener en cuenta que puede ser grabado al otro lado. Una vez obtenida y grabada esa imagen o secuencia comprometida, se pasa del engatusamiento al más cruel chantaje. Por eso es importante usarla únicamente con interlocutores de máxima confianza y no hacer delante de ella nada que no se haría en público. Si se pretende conocer la identidad del interlocutor y se intercambia con él la imagen de la webcam por unos instantes, se le debe pedir en esos momentos que realice alguna acción particular (por ejemplo, simular unas gafas rodeando sus ojos con los dedos) que nos garantice que no está mostrando una grabación."
14,¿Qué es el robo de identidad en internet?,Derecho,No existe robo de identidad en internet ya que la misma es muy segura. ,Significa el secuestro de una persona,Significa la desaparición de una persona.,Significa usar la identidad de una persona haciéndose pasar por ella en las redes sociales. ,Significa usar la identidad de una persona haciéndose pasar por ella en las redes sociales. ,"El robo de identidad ó usurpación de identidad es la apropiación de la identidad de una persona en la mayoria de los casos en las redes sociales. Es hacerse pasar por esa persona, asumir su identidad ante otras personas en público o en privado, en general para acceder a ciertos recursos o la obtención de créditos y otros beneficios en nombre de esa persona."
15,"¿Qué es Revenge porn, pornovenganza o porno vengativo?",Derecho,Una especie de videos pornos.,Una categoria de video eróticos.,"El uso de imagenes y videos privados, para extorcionar a una persona. ",Una I.T.S.,"El uso de imagenes y videos privados, para extorcionar a una persona. ","La publicación de imágenes pornográficas puede tener muy distintas finalidades. La pornovenganza, que tiene como objetivo último causar un mal a otra persona que no ha consentido el uso en público de sus imágenes íntimas, es el fenómeno que más está creciendo y que crea una mayor victimización siendo las mujeres las afectadas en casi todos los casos. En la mayoria de los casos, estos videos se viralizan por exparejas. "
16,Sexting ¿por qué son más vulnerables los adolescentes?,Derecho,Porque tienen mayor acceso a internet.,Porque hay poco control de los padres.,Porque hay una mayor exposición de la intimidad en las redes sociales. ,Todas las anteriores,Todas las anteriores,"En el sexting, el menor es el que realiza una fotografía o vídeo con contenido sexual y la distribuye o publica de manera voluntaria. En este caso el menor no está percibiendo la posible amenza contra su privacidad, ni es consciente de las implicaciones desde el punto de vista de la seguridad. No se ven los riesgos en la exposición de datos personales, privados e íntimos, a través de las nuevas tecnologías de la comunicación, y por ello los difunden. Se colocan a sí mismos en una situación de vulnerabilidad, en tanto en cuanto unos contenidos de sexting pueden llegar a ser conocidos de forma masiva. "
17,¿Qué significa que una persona es Digna?,Derecho,Qué no tiene valor.,Qué tiene alguna I.T.S.,Que pertence a un grupo de orientación sexual diferente.,Que tiene valor por sí misma. ,Que tiene valor por sí misma. ,"La dignidad hace referencia al valor inherente al ser humano por el simple hecho de ser humano, en cuanto ser racional, dotado de libertad. No se trata de una cualidad otorgada por nadie, sino consustancial al ser humano. No depende de ningún tipo de condicionamiento ni de diferencias étnicas, de sexo, de condición social o cualquier otro tipo.  La Declaración Universal de Derechos Humanos invoca en su Preámbulo la «dignidad intrínseca (...) de todos los miembros de la familia humana», para luego afirmar que «todos los seres humanos nacen libres e iguales en dignidad y derechos» (artículo 1°)."
18,¿Puede una empresa obligar un trabajador a hacerse un examen de VIH?,Derecho,"Si, para el bien de él y de toda la empresa","Si, porque puede contagiar a sus compañeros. ","Si, una empresa puede obligarlo e incluso despedirlo si tiene HIV. ",No. El VIH/SIDA no debe tratarse como una cuestión de salud laboral ,No. El VIH/SIDA no debe tratarse como una cuestión de salud laboral ,"No. La Resolución Nº 270/15 del Ministerio de Trabajo, Empleo y Seguridad Social de la Nación Argentina expresa que la exigencia de realizar estudios de laboratorio con el objeto de detectar el VIH en los/as postulantes a trabajador/a dentro de los exámenes preocupacionales podrá ser motivo de denuncia. La obstrucción al empleo motivada por el testeo de VIH es un acto discriminatorio establecido por la ley 23.592 (ley contra actos discriminatorios)."
19," Una persona, ¿está obligado a hacerse la prueba de VIH?",Derecho,"Si, porque se puede contagiar a otras personas. ","No, porque no hay riesgo de contagio. ","No, pero es recomendable realizarla periodicamente. ","Si, sobre todo si tiene conductas sexuales de riesgo. ","No, pero es recomendable realizarla periodicamente. ","No. La prueba de VIH no es obligatoria. Sin embargo, es recomendable realizarla, ya que cuanto antes una persona se entere de su diagnóstico positivo, antes puede acceder al control y al tratamiento, y así mejorar su calidad de vida. En nuestro país, el Estado garantiza, mediante la Ley Nacional de Sida, 23.798, el acceso gratuito y confidencial al diagnóstico, al tratamiento antirretroviral, y a la asistencia de salud integral que derive de la serología positiva de una persona."
20,"Un menor de edad, ¿puede hacerse la prueba de VIH?",Derecho,"No, porque son menores. ","No, porque no son maduros. ","Si, porque tienen que hacerse cargo de sus decisiones. ","Si, no es necesario ser mayor de 18 años. ","Si, no es necesario ser mayor de 18 años. ","Para hacerse la prueba de VIH no es necesario que ser mayor de 18 años. Si bien es recomendable que se acuda a los servicios de salud acompañado/a por un adulto, si por algún motivo no se  quiere o no se puede concurrir acompañado de un adulto, el Código Civil y Comercial del Nación (Art. 26) establece que  el adolescente entre 13 y 16 años tiene aptitud para decidir por sí respecto de aquellos tratamientos que no sean invasivos, y que los mayores de 16 años son considerados adultos en lo referente a las decisiones de cuidado de su propio cuerpo."
21,"Una persona que se quiere afiliar a una obra social o prepaga, ¿puese ser obligada a hacerme la prueba de VIH?",Derecho,"Si, porque se puede contagiar a otras personas. ","Si, porque representa un gasto mayor para la obra social. ","No, nadie puede obligar a hacerse una prueba de HIV.","Depende, si la obra social es prestigiosa. ","No, nadie puede obligar a hacerse una prueba de HIV.","No, nadie puede obligarte a hacerte la prueba. En Argentina, la Ley 24.455 establece la obligatoriedad para las Obras Sociales de ofrecer tratamientos médicos, psicológicos y farmacológicos a las personas con VIH con el 100% de la cobertura a través del Programa Médico Obligatorio, y la Ley de Prepagas 24.754 obliga a éstas a ofrecer los mismos beneficios que las Obras Sociales. Si bien no te van a hacer la prueba, al ingresar a las prepagas deberás firmar una Declaración Jurada en la que tendrás que declarar tu estado de salud."
